{
  "$schema": "../schema/service.schema.json",
  "serviceId": "hdinsight",
  "displayName": "HDInsight",
  "shortName": "HDI",
  "category": "Analytics",
  "description": "OPEN SOURCE ANALYTICS",
  "color": "#2563eb",
  "governanceStatus": "not-approved",
  "icon": "general/10001-icon-service-All-Resources.svg",
  "terraform": {
    "resourceType": null,
    "armResourceTypes": [],
    "automaticArguments": [],
    "parameters": []
  },
  "controls": []
}
