{
  "$schema": "../schema/service.schema.json",
  "serviceId": "security_copilot",
  "displayName": "Microsoft Security Copilot",
  "shortName": "SC",
  "category": "AI + Machine Learning",
  "description": "GENERATIVE AI SECURITY",
  "color": "#7c3aed",
  "governanceStatus": "not-approved",
  "icon": "identity/00321-icon-service-Security.svg",
  "terraform": {
    "resourceType": null,
    "armResourceTypes": [],
    "automaticArguments": [],
    "parameters": []
  },
  "controls": []
}
