{
  "$schema": "../schema/service.schema.json",
  "serviceId": "documentdb",
  "displayName": "Azure DocumentDB",
  "shortName": "DOCDB",
  "category": "Databases",
  "description": "MONGODB-COMPATIBLE DATABASE",
  "color": "#2563eb",
  "governanceStatus": "not-approved",
  "icon": "general/10001-icon-service-All-Resources.svg",
  "terraform": {
    "resourceType": null,
    "armResourceTypes": [],
    "automaticArguments": [],
    "parameters": []
  },
  "controls": []
}
