{
  "$schema": "../../schema/service.schema.json",
  "serviceId": "graph_data_connect",
  "displayName": "Microsoft Graph Data Connect",
  "shortName": "GDC",
  "category": "Analytics",
  "description": "MICROSOFT 365 DATA CONNECTOR",
  "color": "#2563eb",
  "governanceStatus": "not-approved",
  "icon": "general/10001-icon-service-All-Resources.svg",
  "terraform": {
    "resourceType": null,
    "armResourceTypes": [],
    "automaticArguments": [],
    "parameters": []
  },
  "controls": []
}
