{
  "$schema": "../../schema/service.schema.json",
  "serviceId": "translator",
  "displayName": "AI Translator",
  "shortName": "TR",
  "category": "AI + Machine Learning",
  "description": "LANGUAGE TRANSLATION",
  "color": "#2563eb",
  "governanceStatus": "not-approved",
  "icon": "ai + machine learning/00028-icon-service-Batch-AI.svg",
  "terraform": {
    "resourceType": null,
    "armResourceTypes": [],
    "automaticArguments": [],
    "parameters": []
  },
  "controls": []
}
