{
  "$schema": "../../schema/service.schema.json",
  "serviceId": "azure_pipelines",
  "displayName": "Azure Pipelines",
  "shortName": "PIPE",
  "category": "Developer Tools",
  "description": "CONTINUOUS DELIVERY",
  "color": "#2563eb",
  "governanceStatus": "not-approved",
  "icon": "general/10001-icon-service-All-Resources.svg",
  "terraform": {
    "resourceType": null,
    "armResourceTypes": [],
    "automaticArguments": [],
    "parameters": []
  },
  "controls": []
}
