{
  "$schema": "../schema/service.schema.json",
  "serviceId": "language_service",
  "displayName": "AI Language",
  "shortName": "LANG",
  "category": "AI + Machine Learning",
  "description": "NATURAL LANGUAGE AI",
  "color": "#7c3aed",
  "governanceStatus": "not-approved",
  "icon": "ai + machine learning/00028-icon-service-Batch-AI.svg",
  "terraform": {
    "resourceType": null,
    "armResourceTypes": [],
    "automaticArguments": [],
    "parameters": []
  },
  "controls": []
}
