{
  "$schema": "../../schema/service.schema.json",
  "serviceId": "foundry_iq",
  "displayName": "Foundry IQ",
  "shortName": "IQ",
  "category": "AI + Machine Learning",
  "description": "AGENT KNOWLEDGE GROUNDING",
  "color": "#7c3aed",
  "governanceStatus": "not-approved",
  "icon": "general/10001-icon-service-All-Resources.svg",
  "terraform": {
    "resourceType": null,
    "armResourceTypes": [],
    "automaticArguments": [],
    "parameters": []
  },
  "controls": []
}
