{
  "$schema": "../../schema/service.schema.json",
  "serviceId": "document_intelligence",
  "displayName": "Document Intelligence",
  "shortName": "DOC",
  "category": "AI + Machine Learning",
  "description": "DOCUMENT EXTRACTION",
  "color": "#2563eb",
  "governanceStatus": "not-approved",
  "icon": "general/10001-icon-service-All-Resources.svg",
  "terraform": {
    "resourceType": null,
    "armResourceTypes": [],
    "automaticArguments": [],
    "parameters": []
  },
  "controls": []
}
