{
  "$schema": "../../schema/service.schema.json",
  "serviceId": "stream_analytics",
  "displayName": "Stream Analytics",
  "shortName": "ASA",
  "category": "Analytics",
  "description": "REAL TIME STREAM PROCESSING",
  "color": "#0284c7",
  "governanceStatus": "not-approved",
  "icon": "analytics/00042-icon-service-Stream-Analytics-Jobs.svg",
  "terraform": {
    "resourceType": null,
    "armResourceTypes": [],
    "automaticArguments": [],
    "parameters": []
  },
  "controls": []
}
