{
  "$schema": "../../schema/service.schema.json",
  "serviceId": "foundry_observability",
  "displayName": "Foundry Observability",
  "shortName": "OBS",
  "category": "AI + Machine Learning",
  "description": "AI APPLICATION OBSERVABILITY",
  "color": "#7c3aed",
  "governanceStatus": "not-approved",
  "icon": "general/10001-icon-service-All-Resources.svg",
  "terraform": {
    "resourceType": null,
    "armResourceTypes": [],
    "automaticArguments": [],
    "parameters": []
  },
  "controls": []
}
